{
  "$schema": "../../.workflows/schemas/figma-verdict.schema.json",
  "pass": false,
  "score": 8,
  "summary": "代码层已实现禁用态仅改变背景、白色图标保持不透明；由于当前 Swift 工具链无法解析 OpenClawKit，尚未完成编译与运行截图验证。",
  "deviations": [
    {
      "area": "运行态视觉验证",
      "design": "用户指定禁用背景 RGB (0.102, 0.102, 0.102)，白色图标透明度不变。",
      "impl": "代码值与状态配置一致，但缺少真机或模拟器截图。",
      "severity": "P1",
      "fix": "使用 Swift 6.2 兼容工具链完成编译，并补充禁用态运行截图复核。"
    }
  ],
  "verified_ok": [
    "禁用背景代码值为 RGB (0.102, 0.102, 0.102)",
    "发送按钮 disabledAlpha 配置为 1",
    "adjustsImageWhenDisabled 配置为 false",
    "其他 NMInputButton 默认 disabledAlpha 仍为 0.3",
    "Swift 前端语法解析通过",
    "git diff --check 通过"
  ],
  "reviewed": true
}
